{
  "step": "f3_sit_step_2",
  "tema_id": "gioco-libero-come-incontro-del-bambino-con-il-possibile",
  "domain_selected": "clinico",
  "results": [
    {
      "items": [
        {
          "sit_id": "F3-SIT-001",
          "family_id": "F3-SIT-1",
          "title": "Il campo aperto che resta non abitato",
          "context": {
            "setting": "Ambulatorio pediatrico, bilancio di salute",
            "actors": ["pediatra", "bambino", "caregiver"],
            "age_window": "24 mesi",
            "situation": "case_type: assenza_configurazione. Il bambino è vigile, normoreattivo, collaborante. Quando il pediatra apre l'intervallo non finalizzato e rende disponibili foglio, matita e un piccolo cubo, il bambino resta in attesa adulto-orientata: non c'è angoscia né rifiuto né dolore, semplicemente non si attiva alcun orientamento esplorativo e per cinque minuti il campo resta vuoto."
          },
          "configurational_basis": {
            "source_device_id": null,
            "dominant_node": "campo-desiderabile",
            "function": "proteggere",
            "target_field": "Tempo non finalizzato dell'osservazione clinica",
            "universal_device_type": ["U3", "U6"]
          },
          "micro_mediation": {
            "adult_attitude": "Il pediatra distingue l'apertura procedurale (lato adulto, già prodotta) dall'apertura effettiva (lato bambino, che non si costituisce) e sostiene il vuoto senza riempirlo: non rilancia con domande o proposte per 'far partire' il bambino e non legge la non-azione come tratto o come tappa.",
            "possible_phrase": null,
            "alternative_phrase": null,
            "gesture_or_timing": "Lasciar trascorrere il segmento mantenendo la presenza discreta anche quando 'non succede niente', senza accorciarlo per disagio del vuoto.",
            "avoid": [
              "ricondurre la non-azione a un tratto temperamentale ('è timido', 'poco interattivo', 'da rivalutare')",
              "interpretare l'inerzia come riuscita del dispositivo ('ha rispettato il silenzio')",
              "interpretare l'inerzia come fallimento del bambino ('non ha colto l'apertura')",
              "introdurre una valutazione di tappa proprio nello spazio costruito per sospenderla"
            ]
          },
          "expected_field_effect": "Diventa osservabile la differenza tra un'apertura formale e un'apertura abitata: il vuoto resta leggibile come stato del campo e non viene convertito in indice di tappa né in giudizio sul bambino.",
          "non_prescriptive_note": "La casistica non indica cosa fare per 'attivare' il bambino: mostra una configurazione riconoscibile e lascia esplicitamente indecidibile, entro i pochi minuti, se l'inerzia sia un tratto stabile in setting clinico o una latenza.",
          "methodological_warnings": [
            "Il dispositivo non discrimina tra 'campo che non si apre' e 'campo che si aprirebbe più tardi': non concludere sulla base di una sola visita."
          ]
        },
        {
          "sit_id": "F3-SIT-002",
          "family_id": "F3-SIT-1",
          "title": "L'orientamento autentico catturato dal lato del caregiver",
          "context": {
            "setting": "Ambulatorio pediatrico, visita di controllo",
            "actors": ["pediatra", "bambino", "caregiver"],
            "age_window": "30 mesi",
            "situation": "case_type: configurazione_parziale. Il bambino si attiva con orientamento riconoscibile sugli oggetti neutri (piega il foglio, lo riprende, esplora). Il pediatra mantiene il silenzio non valutativo, ma il caregiver, nonostante il briefing, ricade in commento continuo a bassa voce ('bravo, fai vedere alla dottoressa, dimmi cos'è'); il bambino prosegue ma a tratti si volta in cerca di conferma."
          },
          "configurational_basis": {
            "source_device_id": null,
            "dominant_node": "campo-desiderabile",
            "function": "proteggere",
            "target_field": "Tempo non finalizzato dell'osservazione clinica",
            "universal_device_type": ["U3", "U6"]
          },
          "micro_mediation": {
            "adult_attitude": "Il pediatra legge la parzialità come parzialità: riconosce l'orientamento autentico sul vettore bambino-oggetto e, insieme, la pressione prestazionale che rientra dal lato del caregiver, senza contare come 'orientamento' ciò che è in parte richiesta esibitiva soddisfatta.",
            "possible_phrase": null,
            "alternative_phrase": null,
            "gesture_or_timing": "Un segnale discreto e non correttivo verso il caregiver — uno sguardo, un breve cenno in un momento in cui il bambino è assorbito — che riprende la sospensione senza interrompere il bambino.",
            "avoid": [
              "leggere il bambino come 'collaborante e orientato' registrando come positiva un'osservazione costruita dalla pressione del caregiver",
              "considerare il dispositivo riuscito ignorando la rottura della condizione sul lato caregiver",
              "colpevolizzare il caregiver per la ricaduta o rimproverarlo davanti al bambino"
            ]
          },
          "expected_field_effect": "Il vettore caregiver-bambino torna leggibile come fonte di pressione separata dal segnale del nodo dominante, e diventa osservabile quanto l'orientamento del bambino sia genuino e quanto già orientato al riconoscimento dell'adulto.",
          "non_prescriptive_note": "Non prescrive di 'zittire' il caregiver: mostra che la condizione del desiderio va ri-protetta lateralmente con un gesto situato e reversibile, non con una correzione.",
          "methodological_warnings": [
            "La sovrapposizione delle due letture (il bambino orienta, il caregiver converte) rende difficile separare il segnale del nodo dominante dalla sua immediata cattura."
          ]
        },
        {
          "sit_id": "F3-SIT-003",
          "family_id": "F3-SIT-1",
          "title": "L'apertura che diventa nuovo compito",
          "context": {
            "setting": "Ambulatorio pediatrico, visita di controllo",
            "actors": ["pediatra", "bambino", "caregiver"],
            "age_window": "18 mesi",
            "situation": "case_type: configurazione_distorta_chiudente. Il pediatra applica il dispositivo con scrupolo procedurale ma lo deforma nella qualità del gesto: tono leggermente solenne ('adesso facciamo una cosa importante, hai qualche minuto solo per te'), oggetti disposti ordinatamente e frontalmente, postura attentiva e sguardo fisso in attesa. La forma è completa ma costituisce un compito implicito — 'ora ti osservo mentre ti osservi' — e il bambino prende un oggetto, lo posa e guarda l'adulto."
          },
          "configurational_basis": {
            "source_device_id": null,
            "dominant_node": "campo-desiderabile",
            "function": "proteggere",
            "target_field": "Tempo non finalizzato dell'osservazione clinica",
            "universal_device_type": ["U3", "U6"]
          },
          "micro_mediation": {
            "adult_attitude": "Il pediatra sorveglia la qualità performativa del proprio gesto di apertura — tono ordinario non solenne, postura non frontale, densità attentiva non concentrata, timing che non trasforma la dichiarazione in evento — riconoscendo che la forma piena delle micro-azioni può coesistere con un campo chiudente.",
            "possible_phrase": null,
            "alternative_phrase": null,
            "gesture_or_timing": "Pronunciare l'apertura mentre si compie un'altra azione ordinaria della visita, evitando la disposizione composta degli oggetti e lo sguardo concentrato in attesa.",
            "avoid": [
              "tono solenne o enfatico nel dichiarare l'intervallo ('adesso facciamo una cosa importante')",
              "disporre gli oggetti in modo ordinato e frontale come una scena predisposta",
              "fissare il bambino con attenzione concentrata in attesa di una prestazione",
              "concludere che l'esito 'piatto' è informazione sul bambino dopo aver eseguito alla lettera le micro-azioni"
            ]
          },
          "expected_field_effect": "Diventa percepibile la differenza tra apertura non finalizzata e apertura ritualizzata: la qualità del campo — chiudente o aperta — torna leggibile al di là della corretta esecuzione formale delle micro-azioni.",
          "non_prescriptive_note": "Non aggiunge un nuovo passo procedurale: segnala che è il 'come' del gesto, e non il 'cosa', a decidere la tenuta del dispositivo, e questo non è riducibile a una checklist.",
          "methodological_warnings": [
            "Breaking point strutturale: il dispositivo non dispone di marcatori per qualificare tono, prossimità e teatralità dell'apertura; la cecità non è imputabile a misuso ma alla forma attuale del dispositivo."
          ]
        },
        {
          "sit_id": "F3-SIT-004",
          "family_id": "F3-SIT-1",
          "title": "Il campo che si apre e si richiude a finestre",
          "context": {
            "setting": "Ambulatorio pediatrico in studio condiviso",
            "actors": ["pediatra", "bambino", "caregiver"],
            "age_window": "36 mesi",
            "situation": "case_type: configurazione_oscillante. Il bambino avvia un'esplorazione orientata, ma il flusso è interrotto ricorrentemente da eventi di setting: il telefono di studio squilla, il caregiver fa un commento spontaneo e si corregge, un infermiere bussa per consegnare un fascicolo. Tra un'interruzione e l'altra l'orientamento si forma, si interrompe e si riforma in modo diverso, per finestre di 60-90 secondi."
          },
          "configurational_basis": {
            "source_device_id": null,
            "dominant_node": "campo-desiderabile",
            "function": "proteggere",
            "target_field": "Tempo non finalizzato dell'osservazione clinica",
            "universal_device_type": ["U3", "U6"]
          },